12:18:53.549348 IP 10.18.17.140.41509 > 10.18.17.15.5201: Flags [.], ack 2504876088, win 2004, options [nop,nop,TS val 3225700981 ecr 2308403647,mptcp dss ack 3719309684], length 0
12:18:53.549351 IP 10.18.17.140.49397 > 10.18.17.15.5201: Flags [.], seq 242996117:242997545, ack 2237827977, win 1002, options [nop,nop,TS val 3225700981 ecr 2308403635,mptcp dss ack 721080525 seq 2787820385 subseq 38 len 1428 csum 0x545d], length 1428
12:18:53.549353 IP 10.18.17.140.49397 > 10.18.17.15.5201: Flags [.], seq 1428:2856, ack 1, win 1002, options [nop,nop,TS val 3225700981 ecr 2308403635,mptcp dss ack 721080525 seq 2787821813 subseq 1466 len 1428 csum 0xca02], length 1428
12:18:53.549354 IP 10.18.17.140.49397 > 10.18.17.15.5201: Flags [.], seq 2856:4284, ack 1, win 1002, options [nop,nop,TS val 3225700981 ecr 2308403635,mptcp dss ack 721080525 seq 2787823241 subseq 2894 len 1428 csum 0xcc0b], length 1428
12:18:53.549355 IP 10.18.17.140.49397 > 10.18.17.15.5201: Flags [.], seq 4284:5712, ack 1, win 1002, options [nop,nop,TS val 3225700981 ecr 2308403635,mptcp dss ack 721080525 seq 2787824669 subseq 4322 len 1428 csum 0x2b24], length 1428
12:18:53.549357 IP 10.18.17.140.49397 > 10.18.17.15.5201: Flags [.], seq 5712:7140, ack 1, win 1002, options [nop,nop,TS val 3225700981 ecr 2308403635,mptcp dss ack 721080525 seq 2787826097 subseq 5750 len 1428 csum 0x1301], length 1428
12:18:53.549360 IP 10.18.17.140.49397 > 10.18.17.15.5201: Flags [.], seq 7140:8568, ack 1, win 1002, options [nop,nop,TS val 3225700981 ecr 2308403635,mptcp dss ack 721080525 seq 2787827525 subseq 7178 len 1428 csum 0xa9e2], length 1428
12:18:53.549362 IP 10.18.17.140.49397 > 10.18.17.15.5201: Flags [.], seq 8568:9996, ack 1, win 1002, options [nop,nop,TS val 3225700981 ecr 2308403635,mptcp dss ack 721080525 seq 2787828953 subseq 8606 len 1428 csum 0xb4e8], length 1428
12:18:53.549365 IP 10.18.17.140.49397 > 10.18.17.15.5201: Flags [.], seq 9996:11424, ack 1, win 1002, options [nop,nop,TS val 3225700981 ecr 2308403635,mptcp dss ack 721080525 seq 2787830381 subseq 10034 len 1428 csum 0x5a9c], length 1428
12:18:53.549367 IP 10.18.17.140.49397 > 10.18.17.15.5201: Flags [.], seq 11424:12852, ack 1, win 1002, options [nop,nop,TS val 3225700981 ecr 2308403635,mptcp dss ack 721080525 seq 2787831809 subseq 11462 len 1428 csum 0x821], length 1428
12:18:53.549370 IP 10.18.17.140.49397 > 10.18.17.15.5201: Flags [.], seq 12852:14280, ack 1, win 1002, options [nop,nop,TS val 3225700981 ecr 2308403635,mptcp dss ack 721080525 seq 2787833237 subseq 12890 len 1428 csum 0x2724], length 1428
12:18:53.549727 IP 10.18.17.15.5201 > 10.18.17.140.49397: Flags [.], ack 1428, win 1002, options [nop,nop,TS val 2308403657 ecr 3225700981,mptcp dss ack 2787821813], length 0
12:18:53.549727 IP 10.18.17.15.5201 > 10.18.17.140.49397: Flags [.], ack 2856, win 1002, options [nop,nop,TS val 2308403657 ecr 3225700981,mptcp dss ack 2787823241], length 0
12:18:53.549728 IP 10.18.17.15.5201 > 10.18.17.140.49397: Flags [.], ack 4284, win 1001, options [nop,nop,TS val 2308403657 ecr 3225700981,mptcp dss ack 2787824669], length 0
12:18:53.549728 IP 10.18.17.15.5201 > 10.18.17.140.49397: Flags [.], ack 5712, win 993, options [nop,nop,TS val 2308403657 ecr 3225700981,mptcp dss ack 2787826097], length 0
12:18:53.549728 IP 10.18.17.15.5201 > 10.18.17.140.49397: Flags [.], ack 7140, win 1002, options [nop,nop,TS val 2308403657 ecr 3225700981,mptcp dss ack 2787827525], length 0
12:18:53.549728 IP 10.18.17.15.5201 > 10.18.17.140.49397: Flags [.], ack 8568, win 1002, options [nop,nop,TS val 2308403657 ecr 3225700981,mptcp dss ack 2787828953], length 0
12:18:53.549728 IP 10.18.17.15.5201 > 10.18.17.140.49397: Flags [.], ack 9996, win 1001, options [nop,nop,TS val 2308403657 ecr 3225700981,mptcp dss ack 2787830381], length 0
12:18:53.549729 IP 10.18.17.15.5201 > 10.18.17.140.49397: Flags [.], ack 11424, win 993, options [nop,nop,TS val 2308403657 ecr 3225700981,mptcp dss ack 2787831809], length 0
12:18:53.549810 IP 10.18.17.15.5201 > 10.18.17.140.49397: Flags [.], ack 12852, win 986, options [nop,nop,TS val 2308403657 ecr 3225700981,mptcp dss ack 2787833237], length 0
12:18:53.549810 IP 10.18.17.15.5201 > 10.18.17.140.49397: Flags [.], ack 14280, win 978, options [nop,nop,TS val 2308403657 ecr 3225700981,mptcp dss ack 2787834665], length 0
12:18:53.558001 IP 10.18.17.140.60709 > 10.18.18.15.5201: Flags [.], seq 1865770633:1865772061, ack 280057820, win 2004, options [nop,nop,TS val 4115664457 ecr 3557946575,mptcp dss ack 721080525 seq 2787834665 subseq 1 len 1428 csum 0x34c5], length 1428
12:18:53.558004 IP 10.18.17.140.60709 > 10.18.18.15.5201: Flags [.], seq 1428:2856, ack 1, win 2004, options [nop,nop,TS val 4115664457 ecr 3557946575,mptcp dss ack 721080525 seq 2787836093 subseq 1429 len 1428 csum 0xc210], length 1428
12:18:53.558005 IP 10.18.17.140.60709 > 10.18.18.15.5201: Flags [.], seq 2856:4284, ack 1, win 2004, options [nop,nop,TS val 4115664457 ecr 3557946575,mptcp dss ack 721080525 seq 2787837521 subseq 2857 len 1428 csum 0x2cb2], length 1428
12:18:53.558006 IP 10.18.17.140.60709 > 10.18.18.15.5201: Flags [.], seq 4284:5712, ack 1, win 2004, options [nop,nop,TS val 4115664457 ecr 3557946575,mptcp dss ack 721080525 seq 2787838949 subseq 4285 len 1428 csum 0x8405], length 1428
12:18:53.558007 IP 10.18.17.140.60709 > 10.18.18.15.5201: Flags [.], seq 5712:7140, ack 1, win 2004, options [nop,nop,TS val 4115664457 ecr 3557946575,mptcp dss ack 721080525 seq 2787840377 subseq 5713 len 1428 csum 0xd69], length 1428
12:18:53.558009 IP 10.18.17.140.60709 > 10.18.18.15.5201: Flags [.], seq 7140:8568, ack 1, win 2004, options [nop,nop,TS val 4115664457 ecr 3557946575,mptcp dss ack 721080525 seq 2787841805 subseq 7141 len 1428 csum 0x4877], length 1428
12:18:53.558010 IP 10.18.17.140.60709 > 10.18.18.15.5201: Flags [.], seq 8568:9996, ack 1, win 2004, options [nop,nop,TS val 4115664457 ecr 3557946575,mptcp dss ack 721080525 seq 2787843233 subseq 8569 len 1428 csum 0xf1bf], length 1428
12:18:53.558011 IP 10.18.17.140.60709 > 10.18.18.15.5201: Flags [.], seq 9996:11424, ack 1, win 2004, options [nop,nop,TS val 4115664457 ecr 3557946575,mptcp dss ack 721080525 seq 2787844661 subseq 9997 len 1428 csum 0xd373], length 1428
12:18:53.558012 IP 10.18.17.140.60709 > 10.18.18.15.5201: Flags [.], seq 11424:12852, ack 1, win 2004, options [nop,nop,TS val 4115664457 ecr 3557946575,mptcp dss ack 721080525 seq 2787846089 subseq 11425 len 1428 csum 0x4d78], length 1428
12:18:53.558013 IP 10.18.17.140.60709 > 10.18.18.15.5201: Flags [.], seq 12852:14280, ack 1, win 2004, options [nop,nop,TS val 4115664457 ecr 3557946575,mptcp dss ack 721080525 seq 2787847517 subseq 12853 len 1428 csum 0x656e], length 1428
12:18:53.558243 IP 10.18.18.15.5201 > 10.18.17.140.60709: Flags [.], ack 1428, win 1002, options [nop,nop,TS val 3557946595 ecr 4115664457,mptcp dss ack 2787836093], length 0
12:18:53.558244 IP 10.18.18.15.5201 > 10.18.17.140.60709: Flags [.], ack 2856, win 1002, options [nop,nop,TS val 3557946595 ecr 4115664457,mptcp dss ack 2787837521], length 0
12:18:53.558245 IP 10.18.18.15.5201 > 10.18.17.140.60709: Flags [.], ack 4284, win 1001, options [nop,nop,TS val 3557946595 ecr 4115664457,mptcp dss ack 2787838949], length 0
12:18:53.558245 IP 10.18.18.15.5201 > 10.18.17.140.60709: Flags [.], ack 5712, win 993, options [nop,nop,TS val 3557946595 ecr 4115664457,mptcp dss ack 2787840377], length 0
12:18:53.558246 IP 10.18.18.15.5201 > 10.18.17.140.60709: Flags [.], ack 7140, win 986, options [nop,nop,TS val 3557946595 ecr 4115664457,mptcp dss ack 2787841805], length 0
12:18:53.558528 IP 10.18.18.15.5201 > 10.18.17.140.60709: Flags [.], ack 8568, win 1002, options [nop,nop,TS val 3557946596 ecr 4115664457,mptcp dss ack 2787843233], length 0
12:18:53.558529 IP 10.18.18.15.5201 > 10.18.17.140.60709: Flags [.], ack 9996, win 1002, options [nop,nop,TS val 3557946596 ecr 4115664457,mptcp dss ack 2787844661], length 0
12:18:53.558529 IP 10.18.18.15.5201 > 10.18.17.140.60709: Flags [.], ack 11424, win 1001, options [nop,nop,TS val 3557946596 ecr 4115664457,mptcp dss ack 2787846089], length 0
12:18:53.558530 IP 10.18.18.15.5201 > 10.18.17.140.60709: Flags [.], ack 12852, win 993, options [nop,nop,TS val 3557946596 ecr 4115664457,mptcp dss ack 2787847517], length 0
12:18:53.558530 IP 10.18.18.15.5201 > 10.18.17.140.60709: Flags [.], ack 14280, win 986, options [nop,nop,TS val 3557946596 ecr 4115664457,mptcp dss ack 2787848945], length 0
12:18:53.559784 IP 10.18.17.140.49397 > 10.18.17.15.5201: Flags [.], seq 14280:15708, ack 1, win 2004, options [nop,nop,TS val 3225700991 ecr 2308403657,mptcp dss ack 721080525 seq 2787848945 subseq 14318 len 1428 csum 0x3276], length 1428
12:18:53.559787 IP 10.18.17.140.49397 > 10.18.17.15.5201: Flags [.], seq 15708:17136, ack 1, win 2004, options [nop,nop,TS val 3225700991 ecr 2308403657,mptcp dss ack 721080525 seq 2787850373 subseq 15746 len 1428 csum 0xd836], length 1428
12:18:53.559793 IP 10.18.17.140.49397 > 10.18.17.15.5201: Flags [P.], seq 17136:18564, ack 1, win 2004, options [nop,nop,TS val 3225700991 ecr 2308403657,mptcp dss ack 721080525 seq 2787851801 subseq 17174 len 1428 csum 0xe854], length 1428
12:18:53.559795 IP 10.18.17.140.49397 > 10.18.17.15.5201: Flags [.], seq 18564:19992, ack 1, win 2004, options [nop,nop,TS val 3225700991 ecr 2308403657,mptcp dss ack 721080525 seq 2787853229 subseq 18602 len 1428 csum 0xd179], length 1428
12:18:53.559796 IP 10.18.17.140.49397 > 10.18.17.15.5201: Flags [.], seq 19992:21420, ack 1, win 2004, options [nop,nop,TS val 3225700991 ecr 2308403657,mptcp dss ack 721080525 seq 2787854657 subseq 20030 len 1428 csum 0x53fc], length 1428
12:18:53.559797 IP 10.18.17.140.49397 > 10.18.17.15.5201: Flags [.], seq 21420:22848, ack 1, win 2004, options [nop,nop,TS val 3225700991 ecr 2308403657,mptcp dss ack 721080525 seq 2787856085 subseq 21458 len 1428 csum 0xb53a], length 1428
12:18:53.559799 IP 10.18.17.140.49397 > 10.18.17.15.5201: Flags [.], seq 22848:24276, ack 1, win 2004, options [nop,nop,TS val 3225700991 ecr 2308403657,mptcp dss ack 721080525 seq 2787857513 subseq 22886 len 1428 csum 0x22ce], length 1428
12:18:53.559800 IP 10.18.17.140.49397 > 10.18.17.15.5201: Flags [.], seq 24276:25704, ack 1, win 2004, options [nop,nop,TS val 3225700991 ecr 2308403657,mptcp dss ack 721080525 seq 2787858941 subseq 24314 len 1428 csum 0x394b], length 1428
12:18:53.559802 IP 10.18.17.140.49397 > 10.18.17.15.5201: Flags [.], seq 25704:27132, ack 1, win 2004, options [nop,nop,TS val 3225700991 ecr 2308403657,mptcp dss ack 721080525 seq 2787860369 subseq 25742 len 1428 csum 0x5ac2], length 1428
12:18:53.559803 IP 10.18.17.140.49397 > 10.18.17.15.5201: Flags [.], seq 27132:28560, ack 1, win 2004, options [nop,nop,TS val 3225700991 ecr 2308403657,mptcp dss ack 721080525 seq 2787861797 subseq 27170 len 1428 csum 0xa1bd], length 1428
12:18:53.559808 IP 10.18.17.140.49397 > 10.18.17.15.5201: Flags [.], seq 28560:29988, ack 1, win 2004, options [nop,nop,TS val 3225700991 ecr 2308403657,mptcp dss ack 721080525 seq 2787863225 subseq 28598 len 1428 csum 0x1299], length 1428
12:18:53.559809 IP 10.18.17.140.49397 > 10.18.17.15.5201: Flags [.], seq 29988:31416, ack 1, win 2004, options [nop,nop,TS val 3225700991 ecr 2308403657,mptcp dss ack 721080525 seq 2787864653 subseq 30026 len 1428 csum 0x304f], length 1428
12:18:53.559810 IP 10.18.17.140.49397 > 10.18.17.15.5201: Flags [.], seq 31416:32844, ack 1, win 2004, options [nop,nop,TS val 3225700991 ecr 2308403657,mptcp dss ack 721080525 seq 2787866081 subseq 31454 len 1428 csum 0x8b54], length 1428
12:18:53.559812 IP 10.18.17.140.49397 > 10.18.17.15.5201: Flags [.], seq 32844:34272, ack 1, win 2004, options [nop,nop,TS val 3225700991 ecr 2308403657,mptcp dss ack 721080525 seq 2787867509 subseq 32882 len 1428 csum 0xf1f8], length 1428
12:18:53.559814 IP 10.18.17.140.49397 > 10.18.17.15.5201: Flags [.], seq 34272:35700, ack 1, win 2004, options [nop,nop,TS val 3225700991 ecr 2308403657,mptcp dss ack 721080525 seq 2787868937 subseq 34310 len 1428 csum 0xf2d8], length 1428
12:18:53.559815 IP 10.18.17.140.49397 > 10.18.17.15.5201: Flags [.], seq 35700:37128, ack 1, win 2004, options [nop,nop,TS val 3225700991 ecr 2308403657,mptcp dss ack 721080525 seq 2787870365 subseq 35738 len 1428 csum 0xa82], length 1428
12:18:53.559820 IP 10.18.17.140.49397 > 10.18.17.15.5201: Flags [.], seq 37128:38556, ack 1, win 2004, options [nop,nop,TS val 3225700991 ecr 2308403657,mptcp dss ack 721080525 seq 2787871793 subseq 37166 len 1428 csum 0x14fe], length 1428
12:18:53.559821 IP 10.18.17.140.49397 > 10.18.17.15.5201: Flags [.], seq 38556:39984, ack 1, win 2004, options [nop,nop,TS val 3225700991 ecr 2308403657,mptcp dss ack 721080525 seq 2787873221 subseq 38594 len 1428 csum 0xd68d], length 1428
12:18:53.559827 IP 10.18.17.140.49397 > 10.18.17.15.5201: Flags [.], seq 39984:41412, ack 1, win 2004, options [nop,nop,TS val 3225700991 ecr 2308403657,mptcp dss ack 721080525 seq 2787874649 subseq 40022 len 1428 csum 0xed43], length 1428
12:18:53.559828 IP 10.18.17.140.49397 > 10.18.17.15.5201: Flags [.], seq 41412:42840, ack 1, win 2004, options [nop,nop,TS val 3225700991 ecr 2308403657,mptcp dss ack 721080525 seq 2787876077 subseq 41450 len 1428 csum 0xf8c8], length 1428
12:18:53.560093 IP 10.18.17.15.5201 > 10.18.17.140.49397: Flags [.], ack 15708, win 1002, options [nop,nop,TS val 2308403667 ecr 3225700991,mptcp dss ack 2787850373], length 0
12:18:53.560093 IP 10.18.17.15.5201 > 10.18.17.140.49397: Flags [.], ack 17136, win 1002, options [nop,nop,TS val 2308403667 ecr 3225700991,mptcp dss ack 2787851801], length 0
12:18:53.560094 IP 10.18.17.15.5201 > 10.18.17.140.49397: Flags [.], ack 18564, win 1001, options [nop,nop,TS val 2308403667 ecr 3225700991,mptcp dss ack 2787853229], length 0
12:18:53.560094 IP 10.18.17.15.5201 > 10.18.17.140.49397: Flags [.], ack 19992, win 993, options [nop,nop,TS val 2308403667 ecr 3225700991,mptcp dss ack 2787854657], length 0
12:18:53.560094 IP 10.18.17.15.5201 > 10.18.17.140.49397: Flags [.], ack 21420, win 986, options [nop,nop,TS val 2308403667 ecr 3225700991,mptcp dss ack 2787856085], length 0
12:18:53.560095 IP 10.18.17.15.5201 > 10.18.17.140.49397: Flags [.], ack 24276, win 991, options [nop,nop,TS val 2308403667 ecr 3225700991,mptcp dss ack 2787858941], length 0
12:18:53.560412 IP 10.18.17.15.5201 > 10.18.17.140.49397: Flags [.], ack 27132, win 1002, options [nop,nop,TS val 2308403667 ecr 3225700991,mptcp dss ack 2787861797], length 0
12:18:53.560413 IP 10.18.17.15.5201 > 10.18.17.140.49397: Flags [.], ack 35700, win 982, options [nop,nop,TS val 2308403667 ecr 3225700991,mptcp dss ack 2787870365], length 0
12:18:53.560414 IP 10.18.17.15.5201 > 10.18.17.140.49397: Flags [.], ack 42840, win 1002, options [nop,nop,TS val 2308403667 ecr 3225700991,mptcp dss ack 2787877505], length 0
12:18:53.568300 IP 10.18.17.140.60709 > 10.18.18.15.5201: Flags [.], seq 14280:15708, ack 1, win 2004, options [nop,nop,TS val 4115664467 ecr 3557946595,mptcp dss ack 721080525 seq 2787877505 subseq 14281 len 1428 csum 0xd72f], length 1428
12:18:53.568317 IP 10.18.17.140.60709 > 10.18.18.15.5201: Flags [.], seq 15708:17136, ack 1, win 2004, options [nop,nop,TS val 4115664467 ecr 3557946595,mptcp dss ack 721080525 seq 2787878933 subseq 15709 len 1428 csum 0x3edc], length 1428
12:18:53.568323 IP 10.18.17.140.60709 > 10.18.18.15.5201: Flags [.], seq 17136:18564, ack 1, win 2004, options [nop,nop,TS val 4115664467 ecr 3557946595,mptcp dss ack 721080525 seq 2787880361 subseq 17137 len 1428 csum 0x6a7d], length 1428
12:18:53.568325 IP 10.18.17.140.60709 > 10.18.18.15.5201: Flags [.], seq 18564:19992, ack 1, win 2004, options [nop,nop,TS val 4115664467 ecr 3557946595,mptcp dss ack 721080525 seq 2787881789 subseq 18565 len 1428 csum 0xcffb], length 1428
12:18:53.568326 IP 10.18.17.140.60709 > 10.18.18.15.5201: Flags [.], seq 19992:21420, ack 1, win 2004, options [nop,nop,TS val 4115664467 ecr 3557946595,mptcp dss ack 721080525 seq 2787883217 subseq 19993 len 1428 csum 0x662], length 1428
12:18:53.568328 IP 10.18.17.140.60709 > 10.18.18.15.5201: Flags [P.], seq 21420:22848, ack 1, win 2004, options [nop,nop,TS val 4115664467 ecr 3557946595,mptcp dss ack 721080525 seq 2787884645 subseq 21421 len 1428 csum 0x1cad], length 1428
12:18:53.568329 IP 10.18.17.140.60709 > 10.18.18.15.5201: Flags [.], seq 22848:24276, ack 1, win 2004, options [nop,nop,TS val 4115664467 ecr 3557946595,mptcp dss ack 721080525 seq 2787886073 subseq 22849 len 1428 csum 0x328d], length 1428
12:18:53.568331 IP 10.18.17.140.60709 > 10.18.18.15.5201: Flags [.], seq 24276:25704, ack 1, win 2004, options [nop,nop,TS val 4115664467 ecr 3557946595,mptcp dss ack 721080525 seq 2787887501 subseq 24277 len 1428 csum 0x79b], length 1428
12:18:53.568332 IP 10.18.17.140.60709 > 10.18.18.15.5201: Flags [.], seq 25704:27132, ack 1, win 2004, options [nop,nop,TS val 4115664467 ecr 3557946595,mptcp dss ack 721080525 seq 2787888929 subseq 25705 len 1428 csum 0x887b], length 1428
12:18:53.568333 IP 10.18.17.140.60709 > 10.18.18.15.5201: Flags [.], seq 27132:28560, ack 1, win 2004, options [nop,nop,TS val 4115664467 ecr 3557946595,mptcp dss ack 721080525 seq 2787890357 subseq 27133 len 1428 csum 0x14e8], length 1428
12:18:53.568579 IP 10.18.17.140.60709 > 10.18.18.15.5201: Flags [.], seq 28560:29988, ack 1, win 2004, options [nop,nop,TS val 4115664467 ecr 3557946596,mptcp dss ack 721080525 seq 2787891785 subseq 28561 len 1428 csum 0xc279], length 1428
12:18:53.568582 IP 10.18.17.140.60709 > 10.18.18.15.5201: Flags [.], seq 29988:31416, ack 1, win 2004, options [nop,nop,TS val 4115664467 ecr 3557946596,mptcp dss ack 721080525 seq 2787893213 subseq 29989 len 1428 csum 0x2c65], length 1428
12:18:53.568599 IP 10.18.17.140.60709 > 10.18.18.15.5201: Flags [.], seq 31416:32844, ack 1, win 2004, options [nop,nop,TS val 4115664467 ecr 3557946596,mptcp dss ack 721080525 seq 2787894641 subseq 31417 len 1428 csum 0x71c4], length 1428
12:18:53.568601 IP 10.18.17.140.60709 > 10.18.18.15.5201: Flags [.], seq 32844:34272, ack 1, win 2004, options [nop,nop,TS val 4115664467 ecr 3557946596,mptcp dss ack 721080525 seq 2787896069 subseq 32845 len 1428 csum 0xaf93], length 1428
12:18:53.568602 IP 10.18.17.140.60709 > 10.18.18.15.5201: Flags [.], seq 34272:35700, ack 1, win 2004, options [nop,nop,TS val 4115664467 ecr 3557946596,mptcp dss ack 721080525 seq 2787897497 subseq 34273 len 1428 csum 0xffa7], length 1428
12:18:53.568604 IP 10.18.17.140.60709 > 10.18.18.15.5201: Flags [.], seq 35700:37128, ack 1, win 2004, options [nop,nop,TS val 4115664467 ecr 3557946596,mptcp dss ack 721080525 seq 2787898925 subseq 35701 len 1428 csum 0x12b5], length 1428
12:18:53.568615 IP 10.18.17.140.60709 > 10.18.18.15.5201: Flags [.], seq 37128:38556, ack 1, win 2004, options [nop,nop,TS val 4115664467 ecr 3557946596,mptcp dss ack 721080525 seq 2787900353 subseq 37129 len 1428 csum 0xcf42], length 1428
12:18:53.568617 IP 10.18.17.140.60709 > 10.18.18.15.5201: Flags [.], seq 38556:39984, ack 1, win 2004, options [nop,nop,TS val 4115664467 ecr 3557946596,mptcp dss ack 721080525 seq 2787901781 subseq 38557 len 1428 csum 0xc780], length 1428
12:18:53.568622 IP 10.18.17.140.60709 > 10.18.18.15.5201: Flags [.], seq 39984:41412, ack 1, win 2004, options [nop,nop,TS val 4115664467 ecr 3557946596,mptcp dss ack 721080525 seq 2787903209 subseq 39985 len 1428 csum 0x3c1e], length 1428
12:18:53.568624 IP 10.18.17.140.60709 > 10.18.18.15.5201: Flags [.], seq 41412:42840, ack 1, win 2004, options [nop,nop,TS val 4115664467 ecr 3557946596,mptcp dss ack 721080525 seq 2787904637 subseq 41413 len 1428 csum 0xeddc], length 1428
12:18:53.568857 IP 10.18.18.15.5201 > 10.18.17.140.60709: Flags [.], ack 15708, win 2003, options [nop,nop,TS val 3557946606 ecr 4115664467,mptcp dss ack 2787878933], length 0
12:18:53.568858 IP 10.18.18.15.5201 > 10.18.17.140.60709: Flags [.], ack 17136, win 2003, options [nop,nop,TS val 3557946606 ecr 4115664467,mptcp dss ack 2787880361], length 0
12:18:53.568859 IP 10.18.18.15.5201 > 10.18.17.140.60709: Flags [.], ack 18564, win 2003, options [nop,nop,TS val 3557946606 ecr 4115664467,mptcp dss ack 2787881789], length 0
12:18:53.568860 IP 10.18.18.15.5201 > 10.18.17.140.60709: Flags [.], ack 19992, win 2003, options [nop,nop,TS val 3557946606 ecr 4115664467,mptcp dss ack 2787883217], length 0
12:18:53.568861 IP 10.18.18.15.5201 > 10.18.17.140.60709: Flags [.], ack 21420, win 2003, options [nop,nop,TS val 3557946606 ecr 4115664467,mptcp dss ack 2787884645], length 0
12:18:53.568861 IP 10.18.18.15.5201 > 10.18.17.140.60709: Flags [.], ack 22848, win 2003, options [nop,nop,TS val 3557946606 ecr 4115664467,mptcp dss ack 2787886073], length 0
12:18:53.568862 IP 10.18.18.15.5201 > 10.18.17.140.60709: Flags [.], ack 42840, win 2003, options [nop,nop,TS val 3557946606 ecr 4115664467,mptcp dss ack 2787906065], length 0
12:18:53.570160 IP 10.18.17.140.49397 > 10.18.17.15.5201: Flags [.], seq 42840:44268, ack 1, win 2004, options [nop,nop,TS val 3225701002 ecr 2308403667,mptcp dss ack 721080525 seq 2787906065 subseq 42878 len 1428 csum 0xc105], length 1428
12:18:53.570164 IP 10.18.17.140.49397 > 10.18.17.15.5201: Flags [.], seq 44268:45696, ack 1, win 2004, options [nop,nop,TS val 3225701002 ecr 2308403667,mptcp dss ack 721080525 seq 2787907493 subseq 44306 len 1428 csum 0xd9d4], length 1428
12:18:53.570179 IP 10.18.17.140.49397 > 10.18.17.15.5201: Flags [.], seq 45696:47124, ack 1, win 2004, options [nop,nop,TS val 3225701002 ecr 2308403667,mptcp dss ack 721080525 seq 2787908921 subseq 45734 len 1428 csum 0x5de1], length 1428
12:18:53.570180 IP 10.18.17.140.49397 > 10.18.17.15.5201: Flags [.], seq 47124:48552, ack 1, win 2004, options [nop,nop,TS val 3225701002 ecr 2308403667,mptcp dss ack 721080525 seq 2787910349 subseq 47162 len 1428 csum 0x8fba], length 1428
12:18:53.570182 IP 10.18.17.140.49397 > 10.18.17.15.5201: Flags [P.], seq 48552:49980, ack 1, win 2004, options [nop,nop,TS val 3225701002 ecr 2308403667,mptcp dss ack 721080525 seq 2787911777 subseq 48590 len 1428 csum 0x7faf], length 1428
12:18:53.570183 IP 10.18.17.140.49397 > 10.18.17.15.5201: Flags [.], seq 49980:51408, ack 1, win 2004, options [nop,nop,TS val 3225701002 ecr 2308403667,mptcp dss ack 721080525 seq 2787913205 subseq 50018 len 1428 csum 0x268b], length 1428
12:18:53.570184 IP 10.18.17.140.49397 > 10.18.17.15.5201: Flags [.], seq 51408:52836, ack 1, win 2004, options [nop,nop,TS val 3225701002 ecr 2308403667,mptcp dss ack 721080525 seq 2787914633 subseq 51446 len 1428 csum 0x9c30], length 1428
12:18:53.570186 IP 10.18.17.140.49397 > 10.18.17.15.5201: Flags [.], seq 52836:54264, ack 1, win 2004, options [nop,nop,TS val 3225701002 ecr 2308403667,mptcp dss ack 721080525 seq 2787916061 subseq 52874 len 1428 csum 0x9e39], length 1428
12:18:53.570190 IP 10.18.17.140.49397 > 10.18.17.15.5201: Flags [.], seq 54264:55692, ack 1, win 2004, options [nop,nop,TS val 3225701002 ecr 2308403667,mptcp dss ack 721080525 seq 2787917489 subseq 54302 len 1428 csum 0xfd51], length 1428
12:18:53.570192 IP 10.18.17.140.49397 > 10.18.17.15.5201: Flags [.], seq 55692:57120, ack 1, win 2004, options [nop,nop,TS val 3225701002 ecr 2308403667,mptcp dss ack 721080525 seq 2787918917 subseq 55730 len 1428 csum 0xe52e], length 1428
12:18:53.570193 IP 10.18.17.140.49397 > 10.18.17.15.5201: Flags [.], seq 57120:58548, ack 1, win 2004, options [nop,nop,TS val 3225701002 ecr 2308403667,mptcp dss ack 721080525 seq 2787920345 subseq 57158 len 1428 csum 0x7c10], length 1428
12:18:53.570194 IP 10.18.17.140.49397 > 10.18.17.15.5201: Flags [.], seq 58548:59976, ack 1, win 2004, options [nop,nop,TS val 3225701002 ecr 2308403667,mptcp dss ack 721080525 seq 2787921773 subseq 58586 len 1428 csum 0x8716], length 1428
12:18:53.570196 IP 10.18.17.140.49397 > 10.18.17.15.5201: Flags [.], seq 59976:61404, ack 1, win 2004, options [nop,nop,TS val 3225701002 ecr 2308403667,mptcp dss ack 721080525 seq 2787923201 subseq 60014 len 1428 csum 0x2cca], length 1428
12:18:53.570197 IP 10.18.17.140.49397 > 10.18.17.15.5201: Flags [.], seq 61404:62832, ack 1, win 2004, options [nop,nop,TS val 3225701002 ecr 2308403667,mptcp dss ack 721080525 seq 2787924629 subseq 61442 len 1428 csum 0xda4e], length 1428
12:18:53.570465 IP 10.18.17.140.49397 > 10.18.17.15.5201: Flags [.], seq 62832:64260, ack 1, win 2004, options [nop,nop,TS val 3225701002 ecr 2308403667,mptcp dss ack 721080525 seq 2787926057 subseq 62870 len 1428 csum 0xf951], length 1428
12:18:53.570467 IP 10.18.17.140.49397 > 10.18.17.15.5201: Flags [.], seq 64260:65688, ack 1, win 2004, options [nop,nop,TS val 3225701002 ecr 2308403667,mptcp dss ack 721080525 seq 2787927485 subseq 64298 len 1428 csum 0xcf05], length 1428
12:18:53.570468 IP 10.18.17.140.49397 > 10.18.17.15.5201: Flags [.], seq 65688:67116, ack 1, win 2004, options [nop,nop,TS val 3225701002 ecr 2308403667,mptcp dss ack 721080525 seq 2787928913 subseq 65726 len 1428 csum 0x5c51], length 1428
12:18:53.570469 IP 10.18.17.140.49397 > 10.18.17.15.5201: Flags [.], seq 67116:68544, ack 1, win 2004, options [nop,nop,TS val 3225701002 ecr 2308403667,mptcp dss ack 721080525 seq 2787930341 subseq 67154 len 1428 csum 0xc6f2], length 1428
12:18:53.570485 IP 10.18.17.140.49397 > 10.18.17.15.5201: Flags [.], seq 68544:69972, ack 1, win 2004, options [nop,nop,TS val 3225701002 ecr 2308403667,mptcp dss ack 721080525 seq 2787931769 subseq 68582 len 1428 csum 0x1e46], length 1428
12:18:53.570487 IP 10.18.17.140.49397 > 10.18.17.15.5201: Flags [.], seq 69972:71400, ack 1, win 2004, options [nop,nop,TS val 3225701002 ecr 2308403667,mptcp dss ack 721080525 seq 2787933197 subseq 70010 len 1428 csum 0xa7a9], length 1428
12:18:53.570488 IP 10.18.17.140.49397 > 10.18.17.15.5201: Flags [.], seq 71400:72828, ack 1, win 2004, options [nop,nop,TS val 3225701002 ecr 2308403667,mptcp dss ack 721080525 seq 2787934625 subseq 71438 len 1428 csum 0xe2b7], length 1428
12:18:53.570493 IP 10.18.17.140.49397 > 10.18.17.15.5201: Flags [.], seq 72828:74256, ack 1, win 2004, options [nop,nop,TS val 3225701002 ecr 2308403667,mptcp dss ack 721080525 seq 2787936053 subseq 72866 len 1428 csum 0x8c00], length 1428
12:18:53.570494 IP 10.18.17.140.49397 > 10.18.17.15.5201: Flags [.], seq 74256:75684, ack 1, win 2004, options [nop,nop,TS val 3225701002 ecr 2308403667,mptcp dss ack 721080525 seq 2787937481 subseq 74294 len 1428 csum 0x6db4], length 1428
12:18:53.570495 IP 10.18.17.140.49397 > 10.18.17.15.5201: Flags [.], seq 75684:77112, ack 1, win 2004, options [nop,nop,TS val 3225701002 ecr 2308403667,mptcp dss ack 721080525 seq 2787938909 subseq 75722 len 1428 csum 0xe7b8], length 1428
12:18:53.570497 IP 10.18.17.140.49397 > 10.18.17.15.5201: Flags [.], seq 77112:78540, ack 1, win 2004, options [nop,nop,TS val 3225701002 ecr 2308403667,mptcp dss ack 721080525 seq 2787940337 subseq 77150 len 1428 csum 0xffae], length 1428
12:18:53.570498 IP 10.18.17.140.49397 > 10.18.17.15.5201: Flags [.], seq 78540:79968, ack 1, win 2004, options [nop,nop,TS val 3225701002 ecr 2308403667,mptcp dss ack 721080525 seq 2787941765 subseq 78578 len 1428 csum 0xccdb], length 1428
12:18:53.570499 IP 10.18.17.140.49397 > 10.18.17.15.5201: Flags [.], seq 79968:81396, ack 1, win 2004, options [nop,nop,TS val 3225701002 ecr 2308403667,mptcp dss ack 721080525 seq 2787943193 subseq 80006 len 1428 csum 0x729c], length 1428
12:18:53.570500 IP 10.18.17.140.49397 > 10.18.17.15.5201: Flags [P.], seq 81396:82824, ack 1, win 2004, options [nop,nop,TS val 3225701002 ecr 2308403667,mptcp dss ack 721080525 seq 2787944621 subseq 81434 len 1428 csum 0x82ba], length 1428
12:18:53.570502 IP 10.18.17.140.49397 > 10.18.17.15.5201: Flags [.], seq 82824:84252, ack 1, win 2004, options [nop,nop,TS val 3225701002 ecr 2308403667,mptcp dss ack 721080525 seq 2787946049 subseq 82862 len 1428 csum 0x6bdf], length 1428
12:18:53.570503 IP 10.18.17.140.49397 > 10.18.17.15.5201: Flags [.], seq 84252:85680, ack 1, win 2004, options [nop,nop,TS val 3225701002 ecr 2308403667,mptcp dss ack 721080525 seq 2787947477 subseq 84290 len 1428 csum 0xee61], length 1428
12:18:53.570560 IP 10.18.17.140.49397 > 10.18.17.15.5201: Flags [.], seq 85680:87108, ack 1, win 2004, options [nop,nop,TS val 3225701002 ecr 2308403667,mptcp dss ack 721080525 seq 2787948905 subseq 85718 len 1428 csum 0x4fa0], length 1428
12:18:53.570565 IP 10.18.17.140.49397 > 10.18.17.15.5201: Flags [.], seq 87108:88536, ack 1, win 2004, options [nop,nop,TS val 3225701002 ecr 2308403667,mptcp dss ack 721080525 seq 2787950333 subseq 87146 len 1428 csum 0xbd33], length 1428
12:18:53.570567 IP 10.18.17.140.49397 > 10.18.17.15.5201: Flags [.], seq 88536:89964, ack 1, win 2004, options [nop,nop,TS val 3225701002 ecr 2308403667,mptcp dss ack 721080525 seq 2787951761 subseq 88574 len 1428 csum 0xd3b0], length 1428
12:18:53.570568 IP 10.18.17.140.49397 > 10.18.17.15.5201: Flags [.], seq 89964:91392, ack 1, win 2004, options [nop,nop,TS val 3225701002 ecr 2308403667,mptcp dss ack 721080525 seq 2787953189 subseq 90002 len 1428 csum 0xf527], length 1428
12:18:53.570569 IP 10.18.17.140.49397 > 10.18.17.15.5201: Flags [.], seq 91392:92820, ack 1, win 2004, options [nop,nop,TS val 3225701002 ecr 2308403667,mptcp dss ack 721080525 seq 2787954617 subseq 91430 len 1428 csum 0x3c23], length 1428
12:18:53.570586 IP 10.18.17.140.49397 > 10.18.17.15.5201: Flags [.], seq 92820:94248, ack 1, win 2004, options [nop,nop,TS val 3225701002 ecr 2308403667,mptcp dss ack 721080525 seq 2787956045 subseq 92858 len 1428 csum 0xacfe], length 1428
12:18:53.570588 IP 10.18.17.140.49397 > 10.18.17.15.5201: Flags [.], seq 94248:95676, ack 1, win 2004, options [nop,nop,TS val 3225701002 ecr 2308403667,mptcp dss ack 721080525 seq 2787957473 subseq 94286 len 1428 csum 0xcab4], length 1428
12:18:53.570589 IP 10.18.17.140.49397 > 10.18.17.15.5201: Flags [.], seq 95676:97104, ack 1, win 2004, options [nop,nop,TS val 3225701002 ecr 2308403667,mptcp dss ack 721080525 seq 2787958901 subseq 95714 len 1428 csum 0x25ba], length 1428
12:18:53.570591 IP 10.18.17.140.49397 > 10.18.17.15.5201: Flags [.], seq 97104:98532, ack 1, win 2004, options [nop,nop,TS val 3225701002 ecr 2308403667,mptcp dss ack 721080525 seq 2787960329 subseq 97142 len 1428 csum 0x8c5e], length 1428
12:18:53.570592 IP 10.18.17.140.49397 > 10.18.17.15.5201: Flags [.], seq 98532:99960, ack 1, win 2004, options [nop,nop,TS val 3225701002 ecr 2308403667,mptcp dss ack 721080525 seq 2787961757 subseq 98570 len 1428 csum 0x8d3e], length 1428
12:18:53.570812 IP 10.18.17.15.5201 > 10.18.17.140.49397: Flags [.], ack 45696, win 2003, options [nop,nop,TS val 2308403678 ecr 3225701002,mptcp dss ack 2787908921], length 0
12:18:53.570813 IP 10.18.17.15.5201 > 10.18.17.140.49397: Flags [.], ack 48552, win 2003, options [nop,nop,TS val 2308403678 ecr 3225701002,mptcp dss ack 2787911777], length 0
12:18:53.570813 IP 10.18.17.15.5201 > 10.18.17.140.49397: Flags [.], ack 54264, win 2003, options [nop,nop,TS val 2308403678 ecr 3225701002,mptcp dss ack 2787917489], length 0
12:18:53.570814 IP 10.18.17.15.5201 > 10.18.17.140.49397: Flags [.], ack 55692, win 2026, options [nop,nop,TS val 2308403678 ecr 3225701002,mptcp dss ack 2787918917], length 0
12:18:53.570814 IP 10.18.17.15.5201 > 10.18.17.140.49397: Flags [.], ack 57120, win 2048, options [nop,nop,TS val 2308403678 ecr 3225701002,mptcp dss ack 2787920345], length 0
12:18:53.570815 IP 10.18.17.15.5201 > 10.18.17.140.49397: Flags [.], ack 58548, win 2071, options [nop,nop,TS val 2308403678 ecr 3225701002,mptcp dss ack 2787921773], length 0
12:18:53.570815 IP 10.18.17.15.5201 > 10.18.17.140.49397: Flags [.], ack 59976, win 2094, options [nop,nop,TS val 2308403678 ecr 3225701002,mptcp dss ack 2787923201], length 0
12:18:53.570816 IP 10.18.17.15.5201 > 10.18.17.140.49397: Flags [.], ack 61404, win 2117, options [nop,nop,TS val 2308403678 ecr 3225701002,mptcp dss ack 2787924629], length 0
12:18:53.570930 IP 10.18.17.15.5201 > 10.18.17.140.49397: Flags [.], ack 62832, win 2140, options [nop,nop,TS val 2308403678 ecr 3225701002,mptcp dss ack 2787926057], length 0
12:18:53.570930 IP 10.18.17.15.5201 > 10.18.17.140.49397: Flags [.], ack 64260, win 2163, options [nop,nop,TS val 2308403678 ecr 3225701002,mptcp dss ack 2787927485], length 0
12:18:53.570931 IP 10.18.17.15.5201 > 10.18.17.140.49397: Flags [.], ack 65688, win 2185, options [nop,nop,TS val 2308403678 ecr 3225701002,mptcp dss ack 2787928913], length 0
12:18:53.570932 IP 10.18.17.15.5201 > 10.18.17.140.49397: Flags [.], ack 67116, win 2208, options [nop,nop,TS val 2308403678 ecr 3225701002,mptcp dss ack 2787930341], length 0
12:18:53.570932 IP 10.18.17.15.5201 > 10.18.17.140.49397: Flags [.], ack 68544, win 2231, options [nop,nop,TS val 2308403678 ecr 3225701002,mptcp dss ack 2787931769], length 0
12:18:53.570933 IP 10.18.17.15.5201 > 10.18.17.140.49397: Flags [.], ack 69972, win 2254, options [nop,nop,TS val 2308403678 ecr 3225701002,mptcp dss ack 2787933197], length 0
12:18:53.570933 IP 10.18.17.15.5201 > 10.18.17.140.49397: Flags [.], ack 71400, win 2277, options [nop,nop,TS val 2308403678 ecr 3225701002,mptcp dss ack 2787934625], length 0
12:18:53.570934 IP 10.18.17.15.5201 > 10.18.17.140.49397: Flags [.], ack 72828, win 2299, options [nop,nop,TS val 2308403678 ecr 3225701002,mptcp dss ack 2787936053], length 0
12:18:53.570946 IP 10.18.17.15.5201 > 10.18.17.140.49397: Flags [.], ack 74256, win 2322, options [nop,nop,TS val 2308403678 ecr 3225701002,mptcp dss ack 2787937481], length 0
12:18:53.570947 IP 10.18.17.15.5201 > 10.18.17.140.49397: Flags [.], ack 75684, win 2345, options [nop,nop,TS val 2308403678 ecr 3225701002,mptcp dss ack 2787938909], length 0
12:18:53.570947 IP 10.18.17.15.5201 > 10.18.17.140.49397: Flags [.], ack 77112, win 2368, options [nop,nop,TS val 2308403678 ecr 3225701002,mptcp dss ack 2787940337], length 0
12:18:53.570948 IP 10.18.17.15.5201 > 10.18.17.140.49397: Flags [.], ack 78540, win 2391, options [nop,nop,TS val 2308403678 ecr 3225701002,mptcp dss ack 2787941765], length 0
12:18:53.570948 IP 10.18.17.15.5201 > 10.18.17.140.49397: Flags [.], ack 79968, win 2413, options [nop,nop,TS val 2308403678 ecr 3225701002,mptcp dss ack 2787943193], length 0
12:18:53.570949 IP 10.18.17.15.5201 > 10.18.17.140.49397: Flags [.], ack 81396, win 2436, options [nop,nop,TS val 2308403678 ecr 3225701002,mptcp dss ack 2787944621], length 0
12:18:53.570949 IP 10.18.17.15.5201 > 10.18.17.140.49397: Flags [.], ack 82824, win 2459, options [nop,nop,TS val 2308403678 ecr 3225701002,mptcp dss ack 2787946049], length 0
12:18:53.570950 IP 10.18.17.15.5201 > 10.18.17.140.49397: Flags [.], ack 84252, win 2482, options [nop,nop,TS val 2308403678 ecr 3225701002,mptcp dss ack 2787947477], length 0
12:18:53.570962 IP 10.18.17.15.5201 > 10.18.17.140.49397: Flags [.], ack 85680, win 2505, options [nop,nop,TS val 2308403678 ecr 3225701002,mptcp dss ack 2787948905], length 0
12:18:53.570963 IP 10.18.17.15.5201 > 10.18.17.140.49397: Flags [.], ack 87108, win 2528, options [nop,nop,TS val 2308403678 ecr 3225701002,mptcp dss ack 2787950333], length 0
12:18:53.570963 IP 10.18.17.15.5201 > 10.18.17.140.49397: Flags [.], ack 88536, win 2550, options [nop,nop,TS val 2308403678 ecr 3225701002,mptcp dss ack 2787951761], length 0
12:18:53.570964 IP 10.18.17.15.5201 > 10.18.17.140.49397: Flags [.], ack 89964, win 2573, options [nop,nop,TS val 2308403678 ecr 3225701002,mptcp dss ack 2787953189], length 0
12:18:53.570964 IP 10.18.17.15.5201 > 10.18.17.140.49397: Flags [.], ack 91392, win 2596, options [nop,nop,TS val 2308403678 ecr 3225701002,mptcp dss ack 2787954617], length 0
12:18:53.570965 IP 10.18.17.15.5201 > 10.18.17.140.49397: Flags [.], ack 92820, win 2619, options [nop,nop,TS val 2308403678 ecr 3225701002,mptcp dss ack 2787956045], length 0
12:18:53.570965 IP 10.18.17.15.5201 > 10.18.17.140.49397: Flags [.], ack 94248, win 2642, options [nop,nop,TS val 2308403678 ecr 3225701002,mptcp dss ack 2787957473], length 0
12:18:53.570966 IP 10.18.17.15.5201 > 10.18.17.140.49397: Flags [.], ack 95676, win 2664, options [nop,nop,TS val 2308403678 ecr 3225701002,mptcp dss ack 2787958901], length 0
12:18:53.570974 IP 10.18.17.15.5201 > 10.18.17.140.49397: Flags [.], ack 97104, win 2687, options [nop,nop,TS val 2308403678 ecr 3225701002,mptcp dss ack 2787960329], length 0
12:18:53.570974 IP 10.18.17.15.5201 > 10.18.17.140.49397: Flags [.], ack 98532, win 2710, options [nop,nop,TS val 2308403678 ecr 3225701002,mptcp dss ack 2787961757], length 0
12:18:53.570975 IP 10.18.17.15.5201 > 10.18.17.140.49397: Flags [.], ack 99960, win 2733, options [nop,nop,TS val 2308403678 ecr 3225701002,mptcp dss ack 2787963185], length 0
12:18:53.578923 IP 10.18.17.140.60709 > 10.18.18.15.5201: Flags [.], seq 42840:44268, ack 1, win 2004, options [nop,nop,TS val 4115664477 ecr 3557946606,mptcp dss ack 721080525 seq 2787991745 subseq 42841 len 1428 csum 0x8c3b], length 1428
12:18:53.578931 IP 10.18.17.140.60709 > 10.18.18.15.5201: Flags [.], seq 44268:45696, ack 1, win 2004, options [nop,nop,TS val 4115664477 ecr 3557946606,mptcp dss ack 721080525 seq 2787993173 subseq 44269 len 1428 csum 0x48c9], length 1428
12:18:53.578948 IP 10.18.17.140.60709 > 10.18.18.15.5201: Flags [.], seq 45696:47124, ack 1, win 2004, options [nop,nop,TS val 4115664477 ecr 3557946606,mptcp dss ack 721080525 seq 2787994601 subseq 45697 len 1428 csum 0x4107], length 1428
12:18:53.578951 IP 10.18.17.140.60709 > 10.18.18.15.5201: Flags [.], seq 47124:48552, ack 1, win 2004, options [nop,nop,TS val 4115664477 ecr 3557946606,mptcp dss ack 721080525 seq 2787996029 subseq 47125 len 1428 csum 0xb5a4], length 1428
12:18:53.579015 IP 10.18.17.140.60709 > 10.18.18.15.5201: Flags [.], seq 48552:49980, ack 1, win 2004, options [nop,nop,TS val 4115664478 ecr 3557946606,mptcp dss ack 721080525 seq 2787997457 subseq 48553 len 1428 csum 0x6763], length 1428
12:18:53.579018 IP 10.18.17.140.60709 > 10.18.18.15.5201: Flags [.], seq 49980:51408, ack 1, win 2004, options [nop,nop,TS val 4115664478 ecr 3557946606,mptcp dss ack 721080525 seq 2787998885 subseq 49981 len 1428 csum 0x3ab1], length 1428
12:18:53.579028 IP 10.18.17.140.60709 > 10.18.18.15.5201: Flags [.], seq 51408:52836, ack 1, win 2004, options [nop,nop,TS val 4115664478 ecr 3557946606,mptcp dss ack 721080525 seq 2788000313 subseq 51409 len 1428 csum 0x5380], length 1428
12:18:53.579031 IP 10.18.17.140.60709 > 10.18.18.15.5201: Flags [.], seq 52836:54264, ack 1, win 2004, options [nop,nop,TS val 4115664478 ecr 3557946606,mptcp dss ack 721080525 seq 2788001741 subseq 52837 len 1428 csum 0xd78c], length 1428
12:18:53.579037 IP 10.18.17.140.60709 > 10.18.18.15.5201: Flags [P.], seq 54264:55692, ack 1, win 2004, options [nop,nop,TS val 4115664478 ecr 3557946606,mptcp dss ack 721080525 seq 2788003169 subseq 54265 len 1428 csum 0x966], length 1428
12:18:53.579040 IP 10.18.17.140.60709 > 10.18.18.15.5201: Flags [.], seq 55692:57120, ack 1, win 2004, options [nop,nop,TS val 4115664478 ecr 3557946606,mptcp dss ack 721080525 seq 2788004597 subseq 55693 len 1428 csum 0xab5e], length 1428
12:18:53.579047 IP 10.18.17.140.60709 > 10.18.18.15.5201: Flags [.], seq 57120:58548, ack 1, win 2004, options [nop,nop,TS val 4115664478 ecr 3557946606,mptcp dss ack 721080525 seq 2788006025 subseq 57121 len 1428 csum 0x2104], length 1428
12:18:53.579050 IP 10.18.17.140.60709 > 10.18.18.15.5201: Flags [.], seq 58548:59976, ack 1, win 2004, options [nop,nop,TS val 4115664478 ecr 3557946606,mptcp dss ack 721080525 seq 2788007453 subseq 58549 len 1428 csum 0x230d], length 1428
12:18:53.579106 IP 10.18.17.140.60709 > 10.18.18.15.5201: Flags [.], seq 59976:61404, ack 1, win 2004, options [nop,nop,TS val 4115664478 ecr 3557946606,mptcp dss ack 721080525 seq 2788008881 subseq 59977 len 1428 csum 0x8225], length 1428
12:18:53.579109 IP 10.18.17.140.60709 > 10.18.18.15.5201: Flags [.], seq 61404:62832, ack 1, win 2004, options [nop,nop,TS val 4115664478 ecr 3557946606,mptcp dss ack 721080525 seq 2788010309 subseq 61405 len 1428 csum 0x6a02], length 1428
